{
  "schema": "sparkles-reference/1",
  "id": "ps282648-r14",
  "label": "2.00ct E VVS2 — first comparison, quiet centre",
  "identity": {
    "status": "unverified",
    "lab": null,
    "report_number": null
  },
  "linked_diamond_id": null,
  "diamond_metadata": {
    "shape": "Asscher",
    "carat": "2.00",
    "colour": "E",
    "clarity": "VVS2",
    "dimensions": [
      6.95,
      6.92
    ],
    "reported_proportions": {
      "depth_percent": 66.6,
      "table_percent": 58,
      "crown_height_percent": 16,
      "crown_angle_degrees": 37.6
    }
  },
  "commentary": "First of two separate 2.00ct E VVS2 Asschers in the paired video (#1), measuring 6.95 × 6.92 mm with reported depth 66.6%, table 58% and crown 16% / 37.6°. Ibrakeforpossums found its movement comparatively quiet, particularly through the centre, and preferred the second stone (#2); the buyer also preferred the second (#3). This is an observation relative to the pair, not a calibrated failure or proof that the dimensions caused the movement.",
  "source_links": [
    {
      "kind": "discussion",
      "url": "https://www.pricescope.com/community/threads/are-these-asschers-well-cut.282648/",
      "note": "Forum first-versus-second observations #1–#3."
    },
    {
      "kind": "comparison_video",
      "url": "https://imgur.com/a/mKh7jTv",
      "note": "Shared original comparison video; R14 is the FIRST stone."
    }
  ],
  "media_sources": [],
  "topics": [
    "quiet-middle",
    "liveliness",
    "paired-comparison",
    "relative-preference"
  ],
  "evidence": []
}
