{
  "commentary": "DreamStone 566392177 / 4H566392177. 0-0-0 recommended it (#17); Ibrakeforpossums strongly favoured it (#40), and lovedogs endorsed it (#42). The buyer purchased it (#43), later describing it as crisp and flashy (#45/#48). Karl_K praised its face-up pattern and movement (#51). 0-0-0 cautioned that environmental reflections can resemble windowing on tilt (#54). A useful positive example with actual post-purchase videos, not a laboratory performance grade.",
  "diamond_metadata": {
    "carat": "1.97",
    "clarity": "VS1",
    "colour": "D",
    "shape": "Asscher"
  },
  "evidence": [],
  "id": "ps285166-r01",
  "identity": {
    "lab": "IGI",
    "report_number": "LG566392177",
    "status": "reported"
  },
  "label": "1.97ct D VS1 - selected positive example",
  "linked_diamond_id": null,
  "media_sources": [],
  "schema": "sparkles-reference/1",
  "source_links": [
    {
      "kind": "discussion",
      "note": "PriceScope Asscher evaluation thread; post numbers cited in commentary.",
      "url": "https://www.pricescope.com/community/threads/asscher-evaluation-seeking-help.285166/"
    },
    {
      "kind": "listing",
      "note": "Identity assumption accepted by the owner on 2026-10-10 for media retrieval: DreamStone SKU 566392177 matches the Loupe/Nivoda IGI LG566392177 report lookup and Gem360 item d=566392177. The IGI PDF/4Cs were not independently verified; this is reported, not certified.",
      "url": "https://www.dreamstone.com/loose-diamonds/item/Asscher-shape-1.97-carat-D-color-VS1-clarity-DreamStone%2BIdeal-cut-566392177_4H566392177"
    },
    {
      "kind": "real_world_video",
      "note": "Purchased stone, on-hand video",
      "url": "https://youtu.be/_mbHbDMSHMI"
    },
    {
      "kind": "real_world_video",
      "note": "Purchased stone, red-background video",
      "url": "https://youtu.be/f63HihES778"
    }
  ],
  "topics": [
    "liveliness",
    "face-up-pattern",
    "environment-lighting",
    "positive-example"
  ]
}
