{
  "commentary": "lovedogs liked this option (#25/#27), and Karl_K saw potential (#28). 0-0-0 instead noted leakage on tilt (#29), describing under-table steps that fail to flash and stronger-tilt through-view (#32). This is a particularly useful example of different reactions to the same stone. In post #24 the buyer linked IGI's verification page with report parameter `625406458` next to this exact V360 viewer; treat it as a buyer-reported IGI identifier, not independently validated PDF/certificate identity. The supplied v360.diamonds URL is not proof of a locally recoverable v360.in frame sequence.",
  "diamond_metadata": {
    "carat": "2.12",
    "origin": "HPHT lab-grown",
    "shape": "Asscher"
  },
  "evidence": [],
  "id": "ps285166-r07",
  "identity": {
    "status": "reported",
    "lab": "IGI",
    "report_number": "LG625406458"
  },
  "label": "2.12ct HPHT - under-table through-view on tilt",
  "linked_diamond_id": null,
  "media_sources": [
    {
      "kind": "viewer",
      "provider": "v360.diamonds",
      "status": "linked_unverified",
      "url": "https://v360.diamonds/c/72c0cf42-7370-4210-92b0-c1bc7d27ef4b?a=625406458&m=i"
    }
  ],
  "schema": "sparkles-reference/1",
  "source_links": [
    {
      "kind": "discussion",
      "note": "PriceScope Asscher evaluation thread; post numbers cited in commentary.",
      "url": "https://www.pricescope.com/community/threads/asscher-evaluation-seeking-help.285166/"
    },
    {
      "kind": "certificate_link",
      "url": "https://www.igi.org/verify-your-report/?r=625406458",
      "note": "Buyer's original PriceScope post #24 IGI report link accompanying this exact 2.12ct HPHT viewer; source URL observed, PDF contents not independently verified."
    }
  ],
  "topics": [
    "under-table-leakage",
    "tilt",
    "mixed-reactions"
  ]
}
